{
  "schema_version": "0.2.14",
  "trajectory_id": "geometry-trajectory:reference",
  "generated_at": "2026-08-25T01:00:00+00:00",
  "method": "surface_geometry_trajectory_v1",
  "time_unit": "day",
  "observation_count": 3,
  "observations": [
    {
      "observation_id": "obs:current",
      "observed_at": "2026-08-23T00:00:00+00:00",
      "geometry_id": "geometry:reference-base-current"
    },
    {
      "observation_id": "obs:later",
      "observed_at": "2026-08-24T00:00:00+00:00",
      "geometry_id": "geometry:reference-base-later"
    },
    {
      "observation_id": "obs:regressed",
      "observed_at": "2026-08-25T00:00:00+00:00",
      "geometry_id": "geometry:reference-base-regressed"
    }
  ],
  "measurement_contract": {
    "unit": "interaction_depth",
    "reliability_p": 0.9,
    "scope_id": "scope:reference",
    "assessment_method": "monotone_binomial_pava_v1"
  },
  "families": [
    "code",
    "research"
  ],
  "grid": {
    "grid_step": 0.1,
    "adjacency_method": "simplex_single_transfer_v1",
    "adjacency_tolerance": 1e-09
  },
  "boundary_interpolation": {
    "positive_stability": "supported_edge_lower_band_zero_crossing_linear_v1",
    "negative_stability": "supported_edge_upper_band_zero_crossing_linear_v1",
    "zero_tolerance": 1e-12
  },
  "conditioning": {
    "compatible_geometry_contract_required": true,
    "consecutive_motion_delegates_to_v0_2_13": true,
    "boundary_component_matching_is_descriptive_not_identity": true,
    "unsupported_region_interpolated": false,
    "finite_difference_derivatives_are_descriptive": true
  },
  "steps": [
    {
      "step_index": 0,
      "from_observation_id": "obs:current",
      "to_observation_id": "obs:later",
      "elapsed_seconds": 86400.0,
      "elapsed_days": 1.0,
      "subjects": {
        "autonomy": {
          "net_supported_cell_change": 2,
          "split_count": 0,
          "merge_count": 0,
          "positive_boundary_matched_count": 1,
          "positive_boundary_mean_l1_displacement": 0.3522318931527646,
          "support_frontier_mean_l1_displacement": 0.4000000000000001,
          "matched_gradient_edge_count": 5,
          "max_absolute_point_estimate_slope_change": 1.0000000000000235
        },
        "governance": {
          "net_supported_cell_change": 2,
          "split_count": 0,
          "merge_count": 0,
          "positive_boundary_matched_count": 1,
          "positive_boundary_mean_l1_displacement": 0.28290542500725163,
          "support_frontier_mean_l1_displacement": 0.4000000000000001,
          "matched_gradient_edge_count": 5,
          "max_absolute_point_estimate_slope_change": 1.0000000000000147
        }
      }
    },
    {
      "step_index": 1,
      "from_observation_id": "obs:later",
      "to_observation_id": "obs:regressed",
      "elapsed_seconds": 86400.0,
      "elapsed_days": 1.0,
      "subjects": {
        "autonomy": {
          "net_supported_cell_change": -2,
          "split_count": 0,
          "merge_count": 0,
          "positive_boundary_matched_count": 1,
          "positive_boundary_mean_l1_displacement": 0.3522318931527646,
          "support_frontier_mean_l1_displacement": 0.4000000000000001,
          "matched_gradient_edge_count": 5,
          "max_absolute_point_estimate_slope_change": 1.0000000000000235
        },
        "governance": {
          "net_supported_cell_change": -2,
          "split_count": 0,
          "merge_count": 0,
          "positive_boundary_matched_count": 1,
          "positive_boundary_mean_l1_displacement": 0.28290542500725163,
          "support_frontier_mean_l1_displacement": 0.4000000000000001,
          "matched_gradient_edge_count": 5,
          "max_absolute_point_estimate_slope_change": 1.0000000000000147
        }
      }
    }
  ],
  "subjects": {
    "autonomy": {
      "supported_domain_trajectory": {
        "supported_cell_counts": [
          6,
          8,
          6
        ],
        "step_changes": [
          2,
          -2
        ],
        "step_directions": [
          "expansion",
          "contraction"
        ],
        "direction_reversal_count": 1,
        "net_supported_cell_change": 0,
        "minimum_supported_cell_count": 6,
        "maximum_supported_cell_count": 8
      },
      "stability_boundary_trajectories": {
        "positive": {
          "matching_is_descriptive_not_identity": true,
          "lineage_count": 1,
          "spans_all_observations_count": 1,
          "lineages": [
            {
              "first_observation_index": 0,
              "last_observation_index": 2,
              "observation_count": 3,
              "lifespan_days": 2.0,
              "spans_all_observations": true,
              "points": [
                {
                  "observation_index": 0,
                  "observation_id": "obs:current",
                  "observed_at": "2026-08-23T00:00:00+00:00",
                  "reference_family_weights": {
                    "code": 0.5528922561345437,
                    "research": 0.44710774386545626
                  }
                },
                {
                  "observation_index": 1,
                  "observation_id": "obs:later",
                  "observed_at": "2026-08-24T00:00:00+00:00",
                  "reference_family_weights": {
                    "code": 0.37677630955816144,
                    "research": 0.6232236904418386
                  }
                },
                {
                  "observation_index": 2,
                  "observation_id": "obs:regressed",
                  "observed_at": "2026-08-25T00:00:00+00:00",
                  "reference_family_weights": {
                    "code": 0.5528922561345437,
                    "research": 0.44710774386545626
                  }
                }
              ],
              "velocities": [
                {
                  "from_observation_index": 0,
                  "to_observation_index": 1,
                  "from_observation_id": "obs:current",
                  "to_observation_id": "obs:later",
                  "elapsed_days": 1.0,
                  "l1_displacement": 0.3522318931527646,
                  "l1_speed_per_day": 0.3522318931527646,
                  "signed_family_velocity_per_day": {
                    "code": -0.1761159465763823,
                    "research": 0.1761159465763823
                  }
                },
                {
                  "from_observation_index": 1,
                  "to_observation_index": 2,
                  "from_observation_id": "obs:later",
                  "to_observation_id": "obs:regressed",
                  "elapsed_days": 1.0,
                  "l1_displacement": 0.3522318931527646,
                  "l1_speed_per_day": 0.3522318931527646,
                  "signed_family_velocity_per_day": {
                    "code": 0.1761159465763823,
                    "research": -0.1761159465763823
                  }
                }
              ],
              "accelerations": [
                {
                  "at_observation_index": 1,
                  "at_observation_id": "obs:later",
                  "effective_elapsed_days": 1.0,
                  "signed_family_acceleration_per_day2": {
                    "code": 0.3522318931527646,
                    "research": -0.3522318931527646
                  },
                  "l1_speed_change_per_day2": 0.0
                }
              ],
              "velocity_direction_reversal_count_by_family": {
                "code": 1,
                "research": 1
              },
              "total_path_l1": 0.7044637863055292,
              "net_signed_displacement": {
                "code": 0.0,
                "research": 0.0
              }
            }
          ]
        },
        "negative": {
          "matching_is_descriptive_not_identity": true,
          "lineage_count": 0,
          "spans_all_observations_count": 0,
          "lineages": []
        }
      },
      "component_trajectories": {
        "lineage_identity_is_descriptive": true,
        "lineage_count": 1,
        "spans_all_observations_count": 1,
        "maximum_lifespan_days": 2.0,
        "lineages": [
          {
            "first_observation_index": 0,
            "last_observation_index": 2,
            "observation_count": 3,
            "lifespan_days": 2.0,
            "spans_all_observations": true,
            "split_event_count": 0,
            "merge_event_count": 0,
            "nodes": [
              {
                "observation_index": 0,
                "observation_id": "obs:current",
                "component_id": "supported:0000",
                "members": [
                  "code=0.1|research=0.9",
                  "code=0.2|research=0.8",
                  "code=0.3|research=0.7",
                  "code=0.4|research=0.6",
                  "code=0.5|research=0.5",
                  "code=0.6|research=0.4"
                ]
              },
              {
                "observation_index": 1,
                "observation_id": "obs:later",
                "component_id": "supported:0000",
                "members": [
                  "code=0.1|research=0.9",
                  "code=0.2|research=0.8",
                  "code=0.3|research=0.7",
                  "code=0.4|research=0.6",
                  "code=0.5|research=0.5",
                  "code=0.6|research=0.4",
                  "code=0.7|research=0.3",
                  "code=0.8|research=0.2"
                ]
              },
              {
                "observation_index": 2,
                "observation_id": "obs:regressed",
                "component_id": "supported:0000",
                "members": [
                  "code=0.1|research=0.9",
                  "code=0.2|research=0.8",
                  "code=0.3|research=0.7",
                  "code=0.4|research=0.6",
                  "code=0.5|research=0.5",